Название,Цена,Ссылка,Описание,Просмотров,Дата публикации,Продавец,Адрес,О помещении
"Продам помещение Новая Самара, 60.3 м²",7000000,https://www.avito.ru/samara/kommercheskaya_nedvizhimost/prodam_pomeschenie_novaya_samara_60.3_m_2005680697,"Самара, Мехзавод, ЖК Новая Самара. Нежилое помещение, коммерческая недвижимость, арендный бизнес. Самара, Красноглинский район, п. Мехзавод, квартал 1, дом 33. Продаю нежилое помещение. Расположено в трафиковом месте, рядом магазины Wildberries, Горилка, Суширум, Фабрика качества, Салон красоты. Помещение в долгосрочной аренде. Отдельный вход с улицы. Площадь 60,3 квм, свободного назначение, оборудовано под магазин, студию танцев, спортивный зал, отдельный санузел (туалет+душевая).",-,-,no,-,{}
"Автомойка с оборуд., кафе",4300000,https://www.avito.ru/samara/kommercheskaya_nedvizhimost/avtomoyka_s_oborud._kafe_2197092682,"Продается автомобильная мойка, площадью 100 кв. М., находящаяся на земельном участке 523 кв. М. По адресу: РФ, Самарская обл. Г. Самара, ул. Кабановская 4, От собственника, без комиссии. Основные характеристики и преимущества земельного участка: - в собственности, свидетельство, выписка из Егрп; - участок ровный, прямоугольный, огороженный металлическим забором, с большими воротами, с возможностью въезда грузового транспорта; - 1 линия, рядом Азс, остановка общественного транспорта; - на территории земельного участка располагаются: автомобильная мойка на два авто, полностью оборудованная; - кафе, площадью 60 кв. М. ; - удобное расположение — постоянный транспортный поток; - высокие рекламные возможности — размещение рекламы согласно законодательству РФ; Цена 4 300 000 руб. Идеально подходит для размещения денежных средств в готовый бизнес. Возможен обмен на другую недвижимость, авто технику. Александр, Арт. 19373230.",-,-,no,-,{}
Продам офисное помещение,3500000,https://www.avito.ru/samara/kommercheskaya_nedvizhimost/prodam_ofisnoe_pomeschenie_2965034659,"Продам офисное помещение площадью 176 кв. М на 4 этаже 4-этажного здания по адресу: Самара, Товарная 5 стр. 1. -располагается вдоль дороги, хорошая транспортная доступность, остановка общественного транспорта: можно использовать как -глтлвый арендный бизнес, -со всеми арендаторами заключены договора, -есть парковка. -8 кабинетов, в каждом кабинете установлены кондиционеры; -отличный ремонт. -охранная сигнализация. -интернет. Стоимость 3 500 000 руб, Помощь в подборе кредитных программ от банков на коммерческую недвижимость. По всем вопросам можете обращаться к вашему персональному консультанту: Ирине Мишиной — консультант по коммерческой недвижимости. Арт. 44488095.",-,-,no,-,{}
"Офис, 37.9 м² в ЖК Ильинская Плаза",4358500,https://www.avito.ru/samara/kommercheskaya_nedvizhimost/ofis_37.9_m_v_zhk_ilinskaya_plaza_3360131497,"Продаю Нежилое помещение, 37,9 кв. М., расположенное на 3эт. /3эт. Бизнес Центра в новом сданном ЖК Ильинская Плаза по адресу: Самара, улица Буянова, дом 120 (между улицами Маяковского и Чкалова). Нежилое помещение в предчистовой отделке: залита стяжка пола, оштукатурены стены, в офис установлена металлическая дверь. Окна выходят на ул. Буянова. Холодная вода и канализация заведены в офис. Высота потолков — 3,3м. В стоимость включен хороший качественный ремонт мест общего пользования ( коридоры, сан. Узел, лестница, заменена входная дверь в офисные помещения, в каждый офис установлена входная металлическая дверь). ЖК Ильинская Плаза — комплекс Бизнес класса, состоящий из двух 20 этажных домов и 3 этажной перемычки с коммерческой недвижимостью между ними. Под всем Комплексом расположен подземный паркинг. Фасад первых 3 этажей облицован керамогранитом и в них расположатся магазины, салоны и офисы, квартиры начинаются с 4 этажа. В доме установлены лифты Kone, подъезды на первых этажах выложены керамогранитом, имеются помещения для консьержей. Все балконы в жилом комплексе имеют витражное остекление от пола до потолка. В ближайшее время в комплексе будет осуществлена концепция «Двор Без Машин», на дворовую территорию можно будет заехать для разгрузки через автоматические ворота и зайти пешком через калитки с домофоном. Будет организована круглосуточная охрана квартир, паркинга и офисов. В продаже есть другие офисно-торговые помещения разных площадей (от 18,4 кв. М до 407,3 кв. М) на 2 и 3 этажах. Дом сдан! Право собственности оформлено. Можно делать ремонт и начинать работать. Ипотека возможна. Звоните.",-,-,no,-,{}
Производство 390 м2 (боксы),3750000,https://www.avito.ru/samara/kommercheskaya_nedvizhimost/proizvodstvo_390_m2_boksy_3317299451,"Продажа производственное помещение 390 м2 (боксы). Адрес: г. Самара, Куйбышевский р-н, ул. Камышинская, 25. Помещение 390 м2 состоящее из 2-х боксов и подсобных помещений, стены не несущие есть возможность объединения боксов, организации дополнительных ворот. Основные характеристики: - часть производственного корпуса общей площадью 4022 м2, высота потолка 5,5 м, - ворота 3,6 м выс, возможно сделать дополнительные ворота. - на базе газовая котельная. - асфальтированная площадка перед помещением, возможен маневр большегрузов. - на территории базы находится Ктп 400 кВ. - находится на территории огороженной, асфальтированной базы (4 Га). - возможна покупка дополнительных производственных и офисных площадей как в том же корпусе, так и на территории базы. - возможна рассрочка платежей, обмен на автотранспорт и недвижимость. Стоимость 3 750 000р. Без комиссии для покупателя. Для просмотра помещения или уточнения информации Вы можете в любое время написать нам в чат или позвонить. Напишите параметры требуемого помещения, с указанием способа контакта и мы свяжемся с Вами. Колеганов Андрей. Арт. 52185987.",-,-,no,-,{}
